{
  "protocolVersion": "1.0",
  "schemaVersion": "1.0",
  "messageType": "protocol.handshake.response",
  "messageId": "msg_handshake_response_001",
  "requestId": "req_handshake_001",
  "sessionId": "session_startup_001",
  "timestamp": "2026-07-10T15:30:01+08:00",
  "source": {
    "type": "local-agent",
    "instanceId": "agent_local_001",
    "version": "0.1.0"
  },
  "payload": {
    "accepted": true,
    "selectedProtocolVersion": "1.0",
    "selectedSchemaVersion": "1.0",
    "agentCapabilities": [
      {
        "id": "agent.chat",
        "version": "1.0",
        "available": true,
        "riskLevel": "none"
      },
      {
        "id": "operation.plan",
        "version": "1.0",
        "available": true,
        "riskLevel": "medium"
      }
    ],
    "serverInfo": {
      "instanceId": "agent_local_001",
      "version": "0.1.0",
      "build": "dev"
    },
    "transport": {
      "httpBasePath": "/api/v1",
      "websocketPath": "/ws/v1",
      "heartbeatIntervalMs": 15000,
      "maxMessageBytes": 4194304,
      "supportsCompression": false
    },
    "limitations": []
  }
}
